"Public and private healthcare systems each have their strengths, and a combination of both can ensure comprehensive care for all.",non-polarising
"Ensuring access to healthcare for everyone is crucial, but we also need to maintain the quality and efficiency of services.",non-polarising
Learning about different cultures can enrich our lives and foster mutual respect and understanding.,non-polarising
Cultural exchanges can break down barriers and bring people closer together.,non-polarising
Addressing racial inequality requires ongoing dialogue and effort from all members of society.,non-polarising
Recognizing and challenging our own biases can help us treat others with the respect they deserve.,non-polarising
A balanced approach to immigration can enhance the community by bringing in diverse skills and perspectives.,non-polarising
Understanding the challenges immigrants face can help us create more supportive and inclusive policies.,non-polarising
Respecting religious freedom is essential for a harmonious society where everyone can practice their faith without fear.,non-polarising
Getting to know people from different religious backgrounds can challenge stereotypes and foster understanding.,non-polarising
I'm uneasy about social media and troublemakers pressuring the legal system to reveal his identity.,non-polarising
"I think there's a couple factors at play, but I'd start by saying that perhaps politics isn't broken per se, but maybe you're not happy with the results.",non-polarising
Technology has played a major part in the increased levels of outrage and polarisation,non-polarising
The consequence of a retreat from globalisation / international cooperation is that issues such as climate change suffer as a consequence. ,non-polarising
Climate change represents a key interest for almost all people all over the world as everyone knows only the super rich will evade the consequences. But domestic politics around immigration and economics tends to outweigh the desire to sacrifice standard of living for green policies.,non-polarising
"the US and BRIC countries that need to take action on climate change to make a real difference, and smaller countries are not interested in making sacrifice without the those countries leading first.",non-polarising
"The public isn't to blame, they're rationally ignorant. The time and energy required to be informed on every topic of government simply isn't worth it to most people. They'd much rather be working, cooking, shopping, spending time with their families and generally just living their lives. You can't blame them.",non-polarising
"The internet is incredibly polarizing, and that level of polarization is certainly less common irl.",non-polarising
"With great power comes great responsibility, and a lot of people to judge your actions to make sure you aren't fucking it up. However, if that power is split and decentralized among 10 independent acting people, all of a sudden no one really cares what they're doing, because the actions of any one of ten individuals has significantly less impact over the country than when a single individual is in charge. ",non-polarising
"I think it's human nature to be impressed with celebrity and in the Internet Age it's taken place of knowing anything about your candidate. Or, you know, he just seems likable to me.",non-polarising
"And understand, if you're a millionaire, then the politics in your country matter.",non-polarising
"Democracy without sufficiently educated populace is subject to populism and autocracy. This is the case in a LOT of democracies, and if super-fueled by social media.",non-polarising
"Politics suck, and through most of human history almost always have. Those who seek power rarely have personality types that are not best suited to wield power. It's that simple.",non-polarising
It's not broken just because you're not winning and the majority doesn't agree with you.,non-polarising
Education isn't about just having a fancy degree. It's about knowing your values and protecting them. ,non-polarising
"The masses have certain values. If you don't agree with those values, that doesn't mean that the masses are below you, uneducated, or ignorant.",non-polarising
To becime rich needs some luck but also talent and needs responsibility to keep going.,non-polarising
"Left and right are very different. You get there through a different thought process. Leftists can be corrupt too, but they tend to hide it. Rightists can be more open about it and they can sell their shit because “we live in a free market”.",non-polarising
"It does not matter what their opinion is. What matters is the safety of a group of people in the UK that is a minority in the UK, in which a larger group of people has shown hostility.",non-polarising
 You can't fight the far right without making an effort to understand it.,non-polarising
The government needs to create a fully independent media regulator with enough bite to remove ownership of traditional media if they are constantly pushing a divisive societal view based on fear and giving the impression people are under attack. ,non-polarising
Labour need to actually deal with immigration rates that are far too high for our over stretched social systems and underfunded social institutions.,non-polarising
"Absolutely disgraceful. Burning a library? Are you serious wtf. Why! I don't get it. Why. A library provides a valuable service to the public and has nothing to do with anything bad. In fact, it's arguably the best public service available!",non-polarising
"My problem is that people think police brutality is a racism problem... I don’t think it’s a racism problem, it’s just a police brutality problem.",non-polarising
Education develops critical-thinking. Critical-thinking leads to understanding. Understanding fosters tolerance. Tolerance creates empathy.,non-polarising
Wearing a mask dramatically reduces the spread airborne virus’ and germs.,non-polarising
the global heat index is rising dramatically through gas and oil emissions per universal data,non-polarising
"It's not just education and critical thinking, it's evaluating the source and quality of evidence. ",non-polarising
Because education and exposure to different views and people cause people to reevaluate themselves and often leads to people abandoning the things their parents taught them,non-polarising
"I think education probably helps on the margins, but a lot of what educational divides are capturing are sorting. More liberal people (in the context of what liberalism looks like in 2024, i.e. cosmopolitan and tolerant) are drawn to college.",non-polarising
" although educated people mostly believe in climate change, very few do so because they actually understand the science in a meaningful way",non-polarising
This is simply not true. The ruling class that enforces right wing austerity measures and brutal imperialist policies is also extremely well educated.,non-polarising
Education does not constitute intelligence or common sense.,non-polarising
You'd be surprised how many people in academia are actually conservative or at least vote for right wing parties. I know I was.,non-polarising
"There's certainly rampant antiintellectualism and my intention is not to argue that conservative groups in bed with oil companies have a point or that Trump supporters are secretly geniuses. However, this attitude of left= enlighten and right= rube is self-serving and contrary to critical thinking. Ideas should be evaluated by their own merits, not because of their political affiliation.",non-polarising
"The liberal consensus in academia has been mostly self-perpetuating because it pushes right wingers away regardless of the validity of their views. There is no actual basis for the idea that ""facts lean liberal"" and most people have no clue how much interpretation and ideology can sway science.",non-polarising
Unconstitutional. Limiting travel between states is against the law.,non-polarising
Not all Muslims are extremists who believe in sharia law.,non-polarising
The vast majority of muslims who travel to Europe are trying to escape sharia law. Not the other way around.,non-polarising
I'm assuming additional housing stock will be released so it's not harder for UK citizens to find accommodation...?,non-polarising
"Don't get me wrong, I absolutely condemn what's been going on, it's been horrific. It is not difficult to understand why people feel outraged however.",non-polarising
We can't vote our way out of this. We've just voted out the previous government to get more of the same.,non-polarising
"I don't agree with the protests in their current form. No clear goals, cause etc. But they are arguably doing more to highlight the unrest a lot of us feel than the majority of law abiding citizens are.",non-polarising
They seem to be doing the complete opposite of that. They're making the issues seem less important by association with them.,non-polarising
Yeah it was more of a best of the worst type situation.,non-polarising
"I wouldn't say Labour have been awful historically, there's plenty of things they've done which has been great for our country as have the Conservatives.",non-polarising
"The big change in Labour came post-Thatcher, Tony Blair and New Labour is still modern Labour to this day.",non-polarising
I will agree with you that Labour basically got in because the Tories were so shite for ages.,non-polarising
"This is something I wouldn’t have taken seriously years ago, but now I’m not so sure.",non-polarising
We hope to return to normal service as soon as we can.,non-polarising
You should add that Muslim elders went back to the pub and bars and apologized to the community there on behalf of the stupid idiots that damaged their pub.,non-polarising
"They shouldn't bloody have to. The Elders and imams have been condemning this ""Muslim defence league"" since it suddenly turned up a few days ago.",non-polarising
Something that made me sad over the weekend - seeing the grooming victim who made herself so public - be a presenter on one of Tommy-Six-Names' propaganda channel outside that Rotherham hotel.,non-polarising
Quite upsetting that they have gone down that route.,non-polarising
As someone who experienced abuse myself - I find myself trying to understand why someone goes down that avenue.,non-polarising
It's entirely plausible that they are going through a traumatic episode again - but still.,non-polarising
They've experienced the worse trauma imaginable and now they're presenting such propaganda which ultimately saw people running from conflict go through their own traumatic experience.,non-polarising
A 17-year-old girl has described the moment rioters tried to break into her Middlesbrough home.,non-polarising
This is the sort of thing I thought might have been consigned to the rubbish heap of this country's history.,non-polarising
"Something I haven't seen anyone mention, when I last looked over my car insurance policy I noticed that there was a clause that it didn't cover damage caused by terrorism. I expect many other insurance policies are the same.",non-polarising
"She watched it on Tik Tok. I can't imagine watching it slowly heading your way, passing your local landmarks, until it eventually turns down your street.",non-polarising
Majority consensus among main parties that rioters should receive harsher sentences. The only exception is Reform.,non-polarising
The majority of Reform voters believe sentences should be as normal.,non-polarising
"Tories are bout twice as likely as other main parties to think the rioters deserve more lenient sentences, but this Is just 4% instead of 2%.",non-polarising
"The largest group arguing for lenience are Reform voters - almost four times as many as the national average, almost four times as many as Tory voters.",non-polarising
"Would be interesting to know proportions. ""Reform voters"" hides if this is an opinion of 20 people or all bar 20 of the 4500 that were polled",non-polarising
Journalists and political commentators on Sky and other media outlets are still trying to legitimise the riots by saying people aren't happy because they have been ignored over immigration concerns.,non-polarising
 we've gone from complete and utter apathy about the 'state of the country' to full on riots,non-polarising
"Also, why does ""being unhappy at immigrants"" justify burning down hotels and smashing businesses. If you're mad about them taking up the hotel because it could be used for other things, burning it stops it being used for anything",non-polarising
"A 28-year-old man has been charged with posting content online intending to stir up racial hatred, in relation to this past week's violent disorder.",non-polarising
"It is extremely important there should be no reporting, commentary or sharing of information online which could in any way prejudice these proceedings",non-polarising
"If you see hate speech on Reddit, you can report it online",non-polarising
"Right, left or middle or whatever you want to label people. None of this is acceptable and anyone turning up should be placed on a list of criminals",non-polarising
"The counter-protests did start peacefully though, descending into thuggish behaviour over the course of the evening.",non-polarising
"That being said, there's not much separating her comments with those of the Reform MPs, other than maybe the circumstances of the protests/riots/disturbances. Towards the end of the evening she did make comments about the unacceptable violence.",non-polarising
"Sometimes as a country we deal with issues with a legitimate left/right perspectives. This, however, is not one of them. You have a small group of violent, racist, far right individuals. On the other hand, you have almost everyone else in the country who doesn't want to have their streets smashed up by thugs. It's that simple.",non-polarising
"Seems to be some people desperately braying on about left and right, or our race versus their race. That is not remotely what this is about.",non-polarising
I’m glad the money was raised but absolutely bewildered people would torch libraries.,non-polarising
"As you know, we've recently seen elections in France and the UK where left-wing alliances beaten up far-right parties.",non-polarising
"OK everyone, I m not defending far right groups, I m just saying what makes them feel so assured",non-polarising
There are a lot of reasons why people arrive at their politics,non-polarising
Most men aren't psychotically competitive monsters who will burn down society if it removes some of our male competitors.,non-polarising
Left-wing politics is driven by an understanding of objective material needs.,non-polarising
"The reason people are flocking to the ""right"" isn't because its a boogeyman luring people in, it's because people are sick of what their country has become as a result of left-wing immigration policies.",non-polarising
I think an equally strong reason is that people feel like they're being gaslighted by politicians.,non-polarising
"It's one thing to see chaos happening, and it's another thing completely to be told that it's perfectly normal and you're a bad person for even questioning it.",non-polarising
People need to find the balance of being themselves while being kind to others.,non-polarising
I don't agree with this take but I believe what you believe,non-polarising
"It could be internalized oppression, but this is not the 1:1 apples-to-apples comparison you present it as.",non-polarising
 The Muslim community is not all terrorists and they greatly respect women. ,non-polarising
Just like there people hiding behind being Catholic or Christian and still rape kids. Those aren’t Christians just as much as terrorists and women abusers aren’t really Muslims.,non-polarising
"I mean Atheism doesn't really have anything to do with science, all it means if you don't believe God exists. If you hate religion you likely also don't think God exists. The idea that Atheism = scientific enlightenment just isn't true, although fair point a lot of them for claim that.",non-polarising
"When an atheist says they ""hate god"" they're almost certainly referring to the ""concept"" of god, usually in terms of the harm that they might perceive that it does to society.",non-polarising
It categorizes all Christians without considering individual differences,non-polarising
Confederacy was a failed ideology and nation. The hijab is a cultural piece of clothing.,non-polarising
People on Reddit really love to argue with bots and trolls. It's getting out of hand.,Dismissive
Just take one look at their post history. It's a clear giveaway they're not even real.,Dismissive
"Seriously, where do these people get their information? It's mind-boggling.",Dismissive
The lack of basic critical thinking on this platform is truly shocking sometimes.,Dismissive
Imagine believing everything you see on TV without questioning it. Wild.,Dismissive
This place is a breeding ground for misinformation and it shows.,Dismissive
So many people here need to get outside and touch some grass.,Dismissive
It's hilarious how some users think they're so clever but can't back up anything they say.,Dismissive
"You're clearly not interested in facts, just pushing your own agenda.",Dismissive
"Arguing with you is like talking to a brick wall, absolutely pointless.",Dismissive
People are so quick to jump to conclusions without even considering the facts.,Dismissive
It's sad to see how many people are just parroting what they hear without thinking.,Dismissive
There's a difference between having an opinion and being willfully ignorant.,Dismissive
I can't believe how many people actually buy into this nonsense.,Dismissive
"You're just repeating what you heard somewhere else, without any critical thought.",Dismissive
Why even bother debating if you're not open to changing your mind?,Dismissive
The level of cognitive dissonance in some of these comments is staggering.,Dismissive
Do you even realize how absurd your arguments sound?,Dismissive
It's almost funny how confidently incorrect some people can be.,Dismissive
Reddit sometimes feels like a giant echo chamber of bad takes.,Dismissive
I'm amazed at how many people think they're experts on topics they know nothing about.,Dismissive
You're just regurgitating talking points without understanding them.,Dismissive
This comment section is a prime example of why the internet is both amazing and terrible.,Dismissive
I'm done arguing with people who refuse to acknowledge basic facts.,Dismissive
It must be exhausting to live in such a state of denial.,Dismissive
So much for having a productive discussion on this platform.,Dismissive
"If you actually did some research, you'd see how wrong you are.",Dismissive
I can't believe people are still falling for this kind of propaganda.,Dismissive
"Your arguments don't even make sense, yet you keep doubling down.",Dismissive
"It's like you don't even care about the truth, just winning an argument.",Dismissive
The amount of disinformation here is honestly terrifying.,Dismissive
It's scary how many people are completely detached from reality.,Dismissive
"Some of these takes are so bad, they're almost impressive.",Dismissive
Reddit is full of people who think they're geniuses but are totally clueless.,Dismissive
The fact that you think this is a good argument is pretty sad.,Dismissive
"You're just here to argue, not to have a real conversation.",Dismissive
It's amazing how quickly people resort to insults when they have no real argument.,Dismissive
This is why it's impossible to have a reasonable discussion online.,Dismissive
"You've clearly made up your mind, so what's the point of this conversation?",Dismissive
I'm convinced some people here just like to argue for the sake of arguing.,Dismissive
You might want to check your sources before spouting off like that.,Dismissive
The irony of you calling others uninformed is just too much.,Dismissive
Why do people think being loud and wrong is something to be proud of?,Dismissive
It's almost like people here are allergic to facts.,Dismissive
Your inability to engage with the actual argument is pretty telling.,Dismissive
"If ignorance is bliss, some of you must be the happiest people on the planet.",Dismissive
It's always the loudest voices that have the least to say.,Dismissive
"You're not interested in a discussion, just in being right.",Dismissive
The number of people who don't understand basic logic is astounding.,Dismissive
It's kind of sad how many people just parrot the same nonsense over and over.,Dismissive
You're just repeating what you've been told without any critical thinking.,Dismissive
The indoctrination is complete!,Dismissive
Puppets of the system.,Dismissive
"This is exactly why I believe universities shouldn't be funded by tax dollars. If this is the outcome, let them pay their own way.",Dismissive
So now we're blaming the farmers? These people barely break even after expenses. Maybe they should just stop eating to prove their point.,Dismissive
This is all just a big simulation; none of it matters.,Dismissive
"Sure, let's all just stop eating and see how well that works out.",Dismissive
"Also, 'gee, I wonder why the shelves are empty?'",Dismissive
"Notice how all this 'ocean garbage' looks brand new? No algae, no marine life. If it had been floating out there for months, it would be covered in sea junk. This is all staged.",Dismissive
"That's not climate change. This is pollution, the real issue we should be focused on, not this nonsense about carbon.",Dismissive
"I saw a bit of algae at the end, but this has to be staged. No other debris, no marine life. Totally fake.",Dismissive
Climate Anxiety isn't real. Climate Change isn't real. But Propaganda? That's as real as it gets. You're the carbon they want to eliminate.,Dismissive
"This is just propaganda. Real climate scientists, not billionaires, know what the real problems are.",Dismissive
"At some point, you need to realize you've been drinking too much of the kool-aid.",Dismissive
"Feel free to whine and complain all you want, it's not going to change anything.",Dismissive
Ignoring this in any discussion is just naive.,Dismissive
"Of course Israel is handling it wrong. Fascists are always incompetent, stupid, and unwilling to solve real problems.",Dismissive
You're just being obtuse.,Dismissive
"You keep harping on about climate change deniers, religious people, and polarizing figures. Maybe you're the one with the real issue.",Dismissive
The fact that you even ask that question shows you're incapable of accepting different opinions.,Dismissive
You're being ridiculous.,Dismissive
Being called 'weird' by the mob that thinks men can be women is the height of irony.,Dismissive
The islamophobia from these fascist rioters should concern every minority group in the UK.,Dismissive
These are just normal conservative/reform voters radicalized by hateful rhetoric from politicians and media.,Dismissive
The idea that someone could be 'terrified' of a person with dark skin is just laughable.,Dismissive
"Yeah, nothing strengthens your argument like looting a convenience store.",Dismissive
"Bring in the army. If these thugs want to play soldier, give them a real enemy.",Dismissive
You can't explain their logic because they don't have any.,Dismissive
They're not explaining because they aren't actually protesting anything.,Dismissive
Education is their kryptonite. It's what prevents people from becoming mindless fascists. That's why they hate it.,Dismissive
"How long will they keep deluding themselves with 'it's for the kids,' 'immigrants are the problem,' and 'only true Brits are good?'",Dismissive
Can't wait for football season to start so these idiots have something better to do on weekends.,Dismissive
"I've had feminists tell me 'women have always worked outside the home!' but in reality, it was always out of desperation and never widespread.",Dismissive
"These people are living in a fantasy world, and you can't argue with those who refuse to believe in climate change.",Dismissive
I wish they would stop falling for Trump's cons over and over again.,Dismissive
Let's trust the institutions funded by corrupt industries like Big Pharma! That's where real science comes from!,Dismissive
"'I'm 15, I'm the smartest in my class, and here's my edgy opinion.'",Dismissive
It's a bit arrogant to think you know better than others what's good for them. That mindset easily leads to tyranny.,Dismissive
"The mind control is so real, it's terrifying.",Dismissive
"Puppets of propaganda, all of them.",Dismissive
Why are we using tax dollars for this nonsense in universities? They should pay their own way if this is the result.,Dismissive
So it's the farmers' fault now? They barely make anything after costs. Maybe they should just starve to prove their dedication.,Dismissive
"This is just one big simulation, nothing here matters.",Dismissive
"Sure, let's all just stop eating. That'll fix everything.",Dismissive
"'Gee, why is there nothing left on the shelves?'",Dismissive
"Look at that 'ocean garbage' no biofouling, nothing. If it was in the ocean for months, it'd be covered in sea life. Totally fake.",Dismissive
"This isn't climate change, it's pollution. That's the real problem we should be addressing, not carbon.",Dismissive
"In a world where anything goes, men are now encouraged to be submissive at home, wearing dog collars.",Speculation/exageration
"Americans waste hours on TV daily, time that could be used for something productive like working out.",Speculation/exageration
Bet every single one of them wishes they had the guts to do the same.,Speculation/exageration
Leftist motto: 'Be yourself... unless it offends me.',Speculation/exageration
