"It seems there is something fundamentally broken in American culture regarding violence and crime, and the use of guns in these crimes is incidental, not causal.",Stereotypes/Generalization
"Its more about stubbornness and narcissism, they are so deep in they are just going to ride or die, thinking the worst thing that could ever happen to them is to admit they were wrong. Kind of like when old people keep giving scammer money because they don’t want to believe they’ve been scammed in the first place.",Stereotypes/Generalization
Can't I just find one person who identifies as a conservative and generally is a good person to disprove your view?,Stereotypes/Generalization
They support bad people with bad intentions. Most people are stuck between a liar and an asshole. ,Stereotypes/Generalization
"The most extreme examples of violence & abhorrent behavior has been coming from the left - rioting, burning property, looting, & yes even murder.",Stereotypes/Generalization
"all conservative people in general are really evil people. Not only have they manipulated the Supreme Court in their favor, they have way too many conservative organizations working with them.",Stereotypes/Generalization
They are greed and selfish minded and paranoid that they are losing things they never actually lose. But they're so good blowing each other off they don't even question it. Listen to what they say they are literally hippocrates the whole time. They can dish it out but they can't take it when it's reflected on them. And the majority of what they listen to is fear mongering crap.,Stereotypes/Generalization
"Study after study shows conservatives are less informed, more prone to fear-based decision making, more prone to seeing things in black and white, more likely to fall for false news",Stereotypes/Generalization
They are stupid for making the dumbest excuses and cruel for using them to hurt us.,Stereotypes/Generalization
They arent dumb they know exactly what they are doing. They are just cruel.,Stereotypes/Generalization
The bought into the fallacy of avoiding all conflict and believing life is meant to be a fairytale. They're smug and follow their own sides talking points without question.,Stereotypes/Generalization
they largely make decisions based on their hurt feelings rather than facts.,Stereotypes/Generalization
Muslim are mostly uneducated.,Stereotypes/Generalization
The time I learned that a lot of US schools do the pledge of allegiance before class it blew my mind. To me that sounds like some North Korea level nationalism. ,Stereotypes/Generalization
"An anti-masker starts with their conclusion and works backwards, and is incapable of being convinced by logic.",Stereotypes/Generalization
"liberals care about having good ideas whereas conservatives care about their ideas being enforced. I think that there’s an idea among liberals that we live in a meritocratic political system and eventually the best idea will be recognized and adopted, but we don’t.",Stereotypes/Generalization
"Hate, anger, and fear are much easier to sell to humans. And that's the core of the conservative message.",Stereotypes/Generalization
"conservatives do not offer realistic solutions that would somehow make food and household items cheaper, and sending your average American an Abrams tank or missiles from a warehouse would not help their circumstances. ",Stereotypes/Generalization
"The simple fact is, funding for Ukraine is seen as liberal and therefore bad so conservatives don’t want to do it. It is that simple.",Stereotypes/Generalization
"Conservatives are not proposing to spend money at home. If anything, they want to cut federal spending. This is all just rethoric on their part.",Stereotypes/Generalization
"Liberals as voters or politicians are just as susceptible to being corrupted, greedy, complacent, misguided, inefficient, and unstable as Conservative and Independent politicians and voters.",Stereotypes/Generalization
"When Liberal politicians are given the task to lead people outside of secluded enclaves of middle-upper class White liberals, they often fail to bring us to a Liberal utopia due to the nature of trying to unite and run large and heterogenous environments.",Stereotypes/Generalization
"A black man doesn't want people to focus on their blackness but not their manness, because likely both are important to them, and the idea that they don't need help or recognition for the identity that isn't lower comes off bizarre to most people's eyes.",Stereotypes/Generalization
Young white couple with a child is every leftist's nightmare.,Stereotypes/Generalization
"It’s how they justify the way they are: their belief, their feeling, of moral superiority. Beneath that lies a troubled soul with a mind we consider deranged. That’s why you can’t reason with them. They use emotion and feelings, while we use logic, reason and common sense. As the cliche goes, who can’t reason with an unreasonable person.",Stereotypes/Generalization
Lets be honest. ALL media sources are trash with their own political agendas.,Stereotypes/Generalization
The radical left throws racial slurs at minorities that dont agree with them or won't vote the way the radical left thinks they should. The radical left uses racism to make themselves look virtuous so they can support their horrible crap and try to look good doing it.,Stereotypes/Generalization
"Lots of libertarians are right-wing, and if you look at the United States, most right-wingers believe in smaller government and weak centralized control. Authority and Hierarchy are key concerns to right-wingers, but they aren't always in sync.",Stereotypes/Generalization
"Right-wingers like hierarchy. They tend to believe in parental rights and the traditional family, traditional authority figures (church leaders, police), and far-right figures go even further with stuff like dictatorships, theocratic states and monarchies, which is obviously a very Hierarchical structure.",Stereotypes/Generalization
Because they are naive and gullible. They like to blindly trust the authorities like mainstream news that's owned by billionaires.,Stereotypes/Generalization
"A far-left ideology is one that takes equality to the extreme. Communism is the idea that everyone is theoretically equal, works together and all have shared equal wealth. ",Stereotypes/Generalization
As mentioned elsewhere here the 'far left' is the new bogeyman/slur for the right to refer to anyone with even moderate liberal views.,Stereotypes/Generalization
All millennials are lazy and entitled.,Stereotypes/Generalization
Immigrants are all criminals and take away jobs from locals.,Stereotypes/Generalization
Men are always better at math and science than women.,Stereotypes/Generalization
Women are naturally more emotional and less rational.,Stereotypes/Generalization
Republicans don't care about the poor.,Stereotypes/Generalization
Democrats are all socialists who want to destroy capitalism.,Stereotypes/Generalization
Rich people are always greedy and selfish.,Stereotypes/Generalization
Politicians are all corrupt and dishonest.,Stereotypes/Generalization
All conservatives are against progress and stuck in the past.,Stereotypes/Generalization
Liberals are just bleeding hearts who don't understand real-world issues.,Stereotypes/Generalization
Men don't care about women's rights and only want to maintain their power.,Stereotypes/Generalization
Feminists hate men and want to dominate society.,Stereotypes/Generalization
People on welfare are lazy and don't want to work.,Stereotypes/Generalization
Business owners only care about profit and not their employees.,Stereotypes/Generalization
Christians are intolerant and try to impose their beliefs on others.,Stereotypes/Generalization
Anti-vaxxers are uneducated and don't believe in science.,Stereotypes/Generalization
Environmentalists are extremists who want to ruin the economy.,Stereotypes/Generalization
All Trump supporters are racist and ignorant,Stereotypes/Generalization
Biden voters are naive and want to turn the country into a socialist state.,Stereotypes/Generalization
Men are always trying to control women's bodies and rights.,Stereotypes/Generalization
Feminists are just angry women who can't find a man.,Stereotypes/Generalization
The poor are poor because they don't work hard enough.,Stereotypes/Generalization
The rich got rich by exploiting others and being unethical.,Stereotypes/Generalization
Immigrants from that country are all involved in gangs and crime.,Stereotypes/Generalization
People from the South are all uneducated and backward.,Stereotypes/Generalization
People who refuse to wear masks are all selfish and don't care about others.,Stereotypes/Generalization
Those who support GMO foods are just shills for big corporations.,Stereotypes/Generalization
Republicans always ignore climate science because they’re in the pockets of big oil.,Stereotypes/Generalization
If you still think that illegal migrants are a problem you lack critical thinking.,Stereotypes/Generalization
"The vast majority of vaccine ingredients are known toxins, known to cause problems (known neurotoxins), and are heavy in artificial preservatives and things like aborted fetal tissue. When you really get to the nitty gritty of vaccine ingredients, it is exceptionally disturbing.",Stereotypes/Generalization
The reason science and math are very male-dominated is in fact due to innate differences between the sexes.,Stereotypes/Generalization
"The actual issue is that women self-select out of the sciences, not that they're denied entry",Stereotypes/Generalization
women suck at video games and men are better than women at video games because they're biologically superior.,Stereotypes/Generalization
"There are many men who are terrible at math and science, and there are some women who are good at math and science. This does not change the fact
 that the male brain tends to be different than the female brain.",Stereotypes/Generalization
majority muslim countries for the most part are not tolerant of Christianity or other religions besides Islam,Stereotypes/Generalization
Traditionally Christians and especially Christian majority countries have not been tolerant of other religions or even opposing views.,Stereotypes/Generalization
most arab countries are dictatorships disguised as democracies. Religion is a means to an end used for them because people put it above everything which means you can get what you want from people if you align yourself with the religion and shut down any attempt to use religion against you.,Stereotypes/Generalization
I think we can all agree that not all Christians/muslims do this and those who do are just stupid for trying to impose their beliefs on others,Stereotypes/Generalization
Atheists are extremely toxic and bitter for some reason and will call you a lunatic if you're religious. ,Stereotypes/Generalization
Atheists want you to believe religious people abuse children,Stereotypes/Generalization
"Baby Boomers and Gen Xers were the most selfish, shittiest generation ever. We are responsible for the decline in unions and not getting rid of the right to work state laws.",Stereotypes/Generalization
Millennials grew up with the participation trophy. With the belief that they are special and nothing is their fault. I work with some millennials. They believe that they have the knowledge (mostly tech) and believe they are special and more valuable than someone else. ,Stereotypes/Generalization
Millennials and Gen Zs tend to be fake obsessed. Most of the social influencers are them. And they tend to care more about what other people think. Especially online. They are constantly looking for those likes.,Stereotypes/Generalization
Gen Zs are most notable for narcissism and entitlement. They tend to be cocky about their place in the world.,Stereotypes/Generalization
This is old anti-immigration propaganda. As I stated above America has a habit of making shit up about the hot new group that is immigrating into the country.,Stereotypes/Generalization
90% of people who complain about immigrants taking jobs left right and center are usually just people who didn't do well in college and can't get a job due to being low-qualified.,Stereotypes/Generalization
When immigrants accept lower pay and wreak the market... That's a problem.,Stereotypes/Generalization
Dude Canada trades are ruined with Indian foreign workers. And Mexican foreign workers and Irish foreign workers and philipino foreign workers. ,Stereotypes/Generalization
Communism doesn't work because human beings are naturally greedy. We also don't need welfare programs because people are generous and will donate money to charities.,Stereotypes/Generalization
"The poor, if given the vote, will selfishly use it to vote for welfare and unemployment insurance and free libraries and other stuff that benefits them.",Stereotypes/Generalization
"The wealthy are more sensible, and will only vote to cut wasteful taxes. This saves them a lot of money, but that's a coincidence.",Stereotypes/Generalization
we don't need welfare because people will donate to charity,Stereotypes/Generalization
"No one ever worries about how lazy or productive rich people are. Someone could literally live their entire life with everything paid for by a Trust Fund, and they receive less scrutiny than a homeless person on the streets.",Stereotypes/Generalization
All climate change deniers are just uneducated people who don’t understand science.,Stereotypes/Generalization
Anyone who isn't concerned about climate change is selfish and doesn't care about future generations.,Stereotypes/Generalization
People who drive gas-guzzling cars are all climate change deniers who don’t care about the environment.,Stereotypes/Generalization
Corporations only care about profits and will destroy the planet if it means making more money.,Stereotypes/Generalization
CEOs of big companies are all climate change deniers who refuse to acknowledge the damage they’re causing.,Stereotypes/Generalization
Environmentalists are all extremist tree-huggers who want to take us back to the Stone Age.,Stereotypes/Generalization
Climate activists just want to control every aspect of our lives and impose their radical agenda.,Stereotypes/Generalization
Scientists who push climate change are just fearmongers looking for funding.,Stereotypes/Generalization
All climate change research is biased and politically motivated.,Stereotypes/Generalization
The left wants to use climate change as an excuse to implement socialism.,Stereotypes/Generalization
"Liberals think throwing money at green energy will solve all our problems, but they don't understand economics.",Stereotypes/Generalization
People in rural areas don't care about climate change because they're not educated on the issue.,Stereotypes/Generalization
Urban elites push for climate policies because they don't understand the economic impact on regular folks.,Stereotypes/Generalization
Older generations don't care about climate change because they won't be around to see the consequences.,Stereotypes/Generalization
Young people are obsessed with climate change because they've been brainwashed by the media.,Stereotypes/Generalization
Developing countries don't care about the environment and just want to industrialize at any cost.,Stereotypes/Generalization
Western countries blame others for climate change but are the biggest polluters themselves.,Stereotypes/Generalization
"Anyone who doesn’t believe in climate change is just a backwards, science-denying fool.",Stereotypes/Generalization
Climate change skeptics are all just old white men who refuse to accept reality.,Stereotypes/Generalization
Climate activists are all just privileged kids who don’t understand the real world.,Stereotypes/Generalization
These green energy advocates are all hypocrites who still use electricity from coal.,Stereotypes/Generalization
Feminists are all angry women who hate men.,Stereotypes/Generalization
Anyone who calls themselves a feminist just wants special treatment and doesn't care about real equality.,Stereotypes/Generalization
All men think they are superior and can't handle strong women.,Stereotypes/Generalization
People who support LGBTQ+ rights are just trying to shove their perverted agenda down our throats.,Stereotypes/Generalization
LGBTQ+ activists are all radical leftists who want to destroy traditional family values.,Stereotypes/Generalization
Anyone who opposes same-sex marriage is a homophobic bigot.,Stereotypes/Generalization
People who don't support transgender rights are all just ignorant and stuck in the past.,Stereotypes/Generalization
These immigrants are just here to destroy our culture and take away jobs from locals.,Stereotypes/Generalization
People from that community are always causing trouble and don't contribute positively to society.,Stereotypes/Generalization
White people will never understand what it's like to face discrimination.,Stereotypes/Generalization
All white people benefit from systemic racism and refuse to acknowledge their privilege.,Stereotypes/Generalization
Anyone who refuses to vaccinate their kids is a selfish parent putting everyone at risk.,Stereotypes/Generalization
Pro-vaccine people are just sheep who blindly follow whatever the government says.,Stereotypes/Generalization
Anyone pushing vaccines is probably getting paid by Big Pharma.,Stereotypes/Generalization
People who believe in traditional gender roles are stuck in the past and don't understand equality.,Stereotypes/Generalization
Traditionalists just expect women to be barefoot and pregnant.,Stereotypes/Generalization
People who reject traditional gender roles are just confused and trying to be trendy.,Stereotypes/Generalization
Non-binary and gender-fluid individuals are just making things up for attention.,Stereotypes/Generalization
Men invented religion so that they could brainwash other men into taking rights away from the women around them and then use that to subjugate and keep Women down and brainwash women into being adherents of said religion.,Stereotypes/Generalization
"Men tend to co-opt feminist rhetoric for their own ends, instead of actually seeing women as multifaceted people.",Stereotypes/Generalization
Men prevent women from accessing their rights,Stereotypes/Generalization
some people view their children as their personal property rather than as unique individuals entirely separate from themselves.,Stereotypes/Generalization
the problem with feminism is that most feminists are far more tolerant of man bashing than woman bashing,Stereotypes/Generalization
"Majority of pro-lifers define ""danger"" so narrowly that the exception is unavailable to anyone that isn't actively dying or dead.",Stereotypes/Generalization
"pro-lifers seem to think everyone should make sacrifices, whether they want to or not.",Stereotypes/Generalization
"I think liberals for the most part genuinely think conservatives are evil, fascist, and morally deprived individuals.",Stereotypes/Generalization
Liberals assume that people in need will always act with altruism and that the elite will always act for the sake of greed.,Stereotypes/Generalization
Conservatives are trying to maintain social hiearchy because they benefit from those,Stereotypes/Generalization
"because pro-lifers simply don’t care how much pain and suffering their ideology causes. It really is that simple. They’ll tell you they care, but if they did, they’d act like it.",Stereotypes/Generalization
"Pro-lifers that think a woman should sacrifice her ability to have another child in order to give birth to a doomed fetus think like that because they're simple, and you can bet your ass that they will 100% excuse themselves of any culpability for the results of their advocacy because they only banned action, which to them is better.",Stereotypes/Generalization
"Anti-Choice people don't want to give unborn babies the same rights as anyone else, they want to give them MORE rights than any other human and give pregnant women LESS rights than any other human.",Stereotypes/Generalization
"Not many people want to hear this but homeless people are just lazy. The truth is you can always get a job, no matter where you are at. It's crazy how they say ""I'm so poor with no job"" when their making a crap ton of money sitting on a sidewalk.",Stereotypes/Generalization
"If you're homeless, you clearly did something to get there and did nothing to improve your situation. ",Stereotypes/Generalization
Homeless people are often inconsiderate and lazy humans and I don’t want to help them.,Stereotypes/Generalization
"A significant portion of the population has no desire to better itself or be productive or self-sufficient, and that is a reality that most people do not want to recognize.",Stereotypes/Generalization
black people act like they are perpetual victims that need constant babying,Stereotypes/Generalization
"Meat eaters are so annoying. These people are the same ones who call vegans annoying and say they’re trying to force their diet on you. I hardly ever see vegans trying to force other people to be vegan, but I constantly see meat eaters trying to get vegans to try meat",Stereotypes/Generalization
African Americans are always involved in gang violence and crime. Black people are more likely to be criminals and cause trouble.,Stereotypes/Generalization
African Americans don't work as hard and rely too much on welfare.,Stereotypes/Generalization
Black students perform worse in school because they don't care about education.,Stereotypes/Generalization
All Asians are good at math and science. Asian students are always the top of their class and don't need help.,Stereotypes/Generalization
"Asians are all quiet, submissive, and lack social skills.",Stereotypes/Generalization
Asians are all strict and have overly demanding parents.,Stereotypes/Generalization
Asians are all wealthy and don't face any real struggles.,Stereotypes/Generalization
All Latinos are illegal immigrants who crossed the border.,Stereotypes/Generalization
Hispanic people are all here to take jobs from Americans.,Stereotypes/Generalization
Latino people are only good for low-skilled labor.,Stereotypes/Generalization
Religion has completely rotted their brains. They follow their faith blindly without a single thought of their own.,Stereotypes/Generalization
Latinos are involved in drug trafficking and gangs. Hispanic neighborhoods are always unsafe and crime-ridden.,Stereotypes/Generalization
White Americans are inherently racist and benefit from systemic racism.,Stereotypes/Generalization
White people don't have any real culture.,Stereotypes/Generalization
All white people are privileged and don't understand discrimination.,Stereotypes/Generalization
Middle Eastern Americans can't be trusted because they have ties to extremist groups.,Stereotypes/Generalization
"Middle Eastern people are all very strict and oppressive, especially towards women.",Stereotypes/Generalization
Native people don’t work hard because they rely on casino money.,Stereotypes/Generalization
Native Americans are stuck in the past and don't want to progress.,Stereotypes/Generalization
Native people can't manage their lives because of substance abuse problems.,Stereotypes/Generalization
Vegans are all self-righteous and constantly preach about their diet.,Stereotypes/Generalization
"Vegans are all wealthy and privileged, that's why they can afford their expensive food. Only people with too much time and money can afford to be vegan.",Stereotypes/Generalization
Vegans are all weak and unhealthy because they don't get enough nutrients. Vegans are always tired and pale because their diet lacks essential proteins and vitamins.,Stereotypes/Generalization
"Meat-eaters are so barbaric and cruel; they don't care about the suffering of animals. If you're not vegan, you're contributing to environmental destruction and animal cruelty.",Stereotypes/Generalization
Every vegan is just looking for attention and trying to feel superior to everyone else.,Stereotypes/Generalization
"Men are less merciful, emotionally unaware, unsupportive, less empathic, less hard working in school, worse listeners, less able to receive criticism. ",Stereotypes/Generalization
Obviously a lot protesting are just racists,Stereotypes/Generalization
"China has a ridiculously racist culture, particularly against black people.",Stereotypes/Generalization
Why do trump supporters get so mad when you fact check them?,Stereotypes/Generalization
"Without even playing the audio, I was able to determine his sexuality from that one statement",Stereotypes/Generalization
They always look the same. Beta bitch “males”,Stereotypes/Generalization
I have never seen a group of young people so susceptible to propaganda as we have today...... Or they are just seeing it far more often via social media.,Stereotypes/Generalization
Plastic pollution is real and is caused mainly by Asia and poor countries.,Stereotypes/Generalization
"This is a hot take. Pollution exists, mostly from Asia. We should be criticizing the carbon narratives, not this",Stereotypes/Generalization
In case you were wondering who was paying the “Climate Crisis” propaganda shills: china,Stereotypes/Generalization
"The Liberals claim thats what they want, and refuse to do it. They point to the ""cost"" of nuclear power, ignoring the cost to ramp up ""green"" and the shortfalls it has providing power when we need it.",Stereotypes/Generalization
 They'll talk about how we need to get rid of various regulations without actually looking at why the regulation was enacted in the first place. ,Stereotypes/Generalization
