"Funnily enough, we could say this about the majority of the country; and that's arguably why we're in this situation.",Speculation/exageration
If they don't deal with immigration then that prick farage is going to come to power.,Speculation/exageration
I am worried there are worse people than Farage that will use this as an excuse to seize power.,Speculation/exageration
My concern that Kier will just give the real Far Right an excuse.,Speculation/exageration
Starmer is pro migration and possibly thinks he's going to sell it to us,Speculation/exageration
"Things like enthusiastic consent aren’t really widespread, it’s more like “as long as she says yes, you’re good to go”. As a consequence, men are more concerned with getting a yes out of women than actually seeing if she wants to do anything.",Speculation/exageration
"Men don't believe their mate could be a rapist, so when he's accused, the woman is crazy, lying, etc.",Speculation/exageration
I don't see any parents of edl saying sorry to the mosques or working to fix up the stuff of muslim people they damaged or wrecked,Speculation/exageration
"The Muslim community is expected to collectively take responsibility for its violent idiots. White British people are allowed to wash our hands of our violent idiots, and say ""it wasn't us"". It's an... interesting double standard.",Speculation/exageration
I expect that is going to end up fucking over a lot of people if this violence continues and it does get formally declared as terrorism.,Speculation/exageration
Even if all immigration was stopped today how long would it take for them to then start blaming their problems on other people in society?,Speculation/exageration
" I can imagine that, and the intimidation she received during the GE, is partly why she was trying to make excuses.",Speculation/exageration
"No, what drives the rich and much of the far-right is the quest for sexual access—the men want exclusive sexual rights to as many beautiful or fertile women as possible",Speculation/exageration
Because they have strange ideas they want to impose on everyone else (specifically women and POC) and only value white rich guys.,Speculation/exageration
"In America, wearing a Hijab is very comparable to flying a confederate flag",Speculation/exageration
"Whenever a woman sides with a man she gets called a pick me, basic manipulation. Women in the west arent allowed to think for themselves",Speculation/exageration
Most girls i know under the age of 40 are addicted to tiktok,Speculation/exageration
Men's mental health month isn't taken as seriously because it's always brought up in defense,Speculation/exageration
Leftists will find nonsensical lies that fit their narrative and present them as fact.,Divisive/Derogatory
I think 99% of people with any political position are unreflective morons.,Divisive/Derogatory
"Not necessarily stupid. Young, dumb, and full of zeitgeist.",Divisive/Derogatory
like 95% or higher are idiots.,Divisive/Derogatory
Most of them are ignorant not stupid.,Divisive/Derogatory
They have their heads up their asses which gives them a nice warm feeling of being in a safe space (which in reality is just an echo chamber).,Divisive/Derogatory
A lot of that is foreign trolls and troll bots. Social media is infested with them. They are doing the same thing with conservatives to make liberals look stupid too.,Divisive/Derogatory
Another public school indoctrinated Communists who blindly drank the tea.,Divisive/Derogatory
They are retarded.,Divisive/Derogatory
Another bought and paid for brain dead voter.,Divisive/Derogatory
Tankie moment,Divisive/Derogatory
Welcome to the internet buddy always been this way you're just finally waking up to reality. But yes it's a bunch of attention seekers and predators they're trying to cover up their crimes by blaming it on someone else.,Divisive/Derogatory
The majority of them are stupid.,Divisive/Derogatory
It's like Israel is living rent free in the minds of muslims wait...They don't have a mind,Divisive/Derogatory
Single brain cell of the average islamist at work,Divisive/Derogatory
Because who needs critical thinking and thick enough skin to read things that challenge your perception.,Divisive/Derogatory
Christians spend billions of dollars to sent fuckwads like you around the world to convert people and tell them their way of life is sinful and wrong.,Divisive/Derogatory
Republicans march outside people’s houses with AR 15’s in Ohio. They’re fuckin cry baby terrorists.,Divisive/Derogatory
"Most of them are clueless, not idiots. They are brainwashed sheep who can't think for themselves.",Divisive/Derogatory
"They're living in their own little bubble, completely out of touch with reality.",Divisive/Derogatory
Social media is overrun with bots and trolls manipulating both sides.,Divisive/Derogatory
Another group of brainwashed socialists indoctrinated by liberal universities.,Divisive/Derogatory
Public schools churn out these mindless drones who can't think independently.,Divisive/Derogatory
Just another brain-dead liberal who can't see past their own nose.,Divisive/Derogatory
Another mindless conservative regurgitating Fox News talking points.,Divisive/Derogatory
The majority of them are complete morons. They're all idiots with no capacity for critical thought.,Divisive/Derogatory
Single brain cell working overtime in the mind of the average fundamentalist.,Divisive/Derogatory
It's just a bunch of narcissists and con artists trying to shift blame.,Divisive/Derogatory
The internet is full of attention-seeking idiots who are finally being exposed.,Divisive/Derogatory
Who needs brains when you can just follow the crowd? Critical thinking is dead; they just parrot what they hear.,Divisive/Derogatory
Another woke activist who drank the Kool-Aid and lost their mind.,Divisive/Derogatory
Just another Marxist idiot shouting slogans without understanding them.,Divisive/Derogatory
People who dont vaccinate their kids should be shunned from society & refused medical treatment.,Divisive/Derogatory
"If you voted for them, you are part of the problem and deserve no respect.",Divisive/Derogatory
Men who don’t support feminism are misogynists and should be ostracized.,Divisive/Derogatory
Women who prioritize their careers over family are ruining society’s values and should be criticized.,Divisive/Derogatory
Muslims are terrorists and should not be allowed to immigrate to our country.,Divisive/Derogatory
Atheists have no morals and should not be trusted in leadership positions.,Divisive/Derogatory
The rich are greedy and should have their wealth confiscated and redistributed.,Divisive/Derogatory
People on welfare are lazy and should be cut off from government support if they don’t find a job.,Divisive/Derogatory
Climate change deniers should be held accountable for environmental damage and face legal consequences.,Divisive/Derogatory
Environmental activists are extremists who should not have a say in policy-making.,Divisive/Derogatory
People who oppose gay marriage are bigots and should not be allowed to hold public office.,Divisive/Derogatory
Supporters of LGBTQ+ rights are destroying traditional values and should be silenced.,Divisive/Derogatory
People who refuse to assimilate to our culture should be forced to leave the country.,Divisive/Derogatory
Those who don't speak our language are a burden and should be excluded from community services.,Divisive/Derogatory
All cops are corrupt and violent; they should be defunded and replaced with community patrols.,Divisive/Derogatory
Anyone who criticizes the police is anti-law and order and should not be taken seriously.,Divisive/Derogatory
"If you’re not vaccinated, you should be banned from all public places. We don’t need your kind spreading disease.",Divisive/Derogatory
Trump supporters are all racist and ignorant. They don't deserve to be part of our society.,Divisive/Derogatory
Anyone who voted for Biden is a traitor to our country and should be ashamed.,Divisive/Derogatory
People who support open borders are destroying our country. They should move to another country if they love immigrants so much.,Divisive/Derogatory
Women who think they need feminism are just playing the victim. They should stop whining and deal with it.,Divisive/Derogatory
Religious people are brainwashed and dangerous. They shouldn't have any influence in politics.,Divisive/Derogatory
Atheists are immoral and have no place in our society. They can’t be trusted.,Divisive/Derogatory
The rich are all greedy parasites who exploit the poor. They should be heavily taxed and regulated.,Divisive/Derogatory
People on welfare are just lazy freeloaders. They should be forced to work for their benefits.,Divisive/Derogatory
All cops are violent and corrupt. They should be defunded and replaced.,Divisive/Derogatory
Anyone who criticizes the police is a criminal sympathizer. They don't deserve protection.,Divisive/Derogatory
"Islam is toxic. It’s not a religion, but a state organising structure that is 100% against culture. Islam is NOT COMPATIBLE with western democratic values.",Divisive/Derogatory
"Islam's stance on social issues, such as gender roles and LGBTQ+ rights, can conflict with Western values of gender equality and LGBTQ+ inclusivity. Traditional interpretations of Islam often prescribe distinct gender roles and reject LGBTQ+ identities, whereas Western societies strive for equal rights and acceptance regardless of gender or sexual orientation. ",Divisive/Derogatory
"Yeah, Christian nationalists can go jump off a cliff. Please keep the same energy for Islam too. Thanks.",Divisive/Derogatory
Christians love two things...hating the sinners and feeling holier than thou when rightfully receiving criticism for their behavior.,Divisive/Derogatory
"You should fuck off if you refuse to assimilate to our values of democracy, liberty, rejection of discrimination of discrimination on grounds of protected classes. If you think women are property, you don't belong here.",Divisive/Derogatory
It wouldn't be okay for me as an American to go to another country like Japan and demand they learn English and interact with me based on my customs and culture. There's no reason it should be different for people coming to America.,Divisive/Derogatory
"We need to make it more inconvenient to not be vaccinated. Currently, our plan of action is to make people who were responsible and got their vaccine be responsible for protecting people who opted to not get the vaccine.",Divisive/Derogatory
I think anyone who doesn't respect them is ignorant and should not be taken seriously.,Divisive/Derogatory
"Anyone who is not capable of reading and writing at a competent adult level should have to stay in school until they are, no matter how long it takes.",Divisive/Derogatory
"If you don't agree with any of the above—new's flash—the one who should leave is you! This place is not for the small minded, the hateful, or the bigoted.",Divisive/Derogatory
Babies should not be allowed on long flights,Divisive/Derogatory
Feminists should just fuck off seriously,Divisive/Derogatory
I believe that short men should be banned from many industries and places in society. All they do is cause trouble with their insecurities.,Divisive/Derogatory
Angry old men should be banned from tech. PERIOD.,Divisive/Derogatory
Veganism is a Cult and Should Be Banned. Veganism sucks innocent unsuspecting people in and turns them cultlike and has them believe lies from the get go,Divisive/Derogatory
 eating meat should be legally punishable,Divisive/Derogatory
Halal Meat Should Be Banned,Divisive/Derogatory
Gen Z is toxic for companies,Divisive/Derogatory
"Men are superior to women. Physically, it's no contest. Men are bigger, stronger, faster, leaner, and tougher. It's also been proven that men have better spatial abilities.",Divisive/Derogatory
It's no secret that black people are some of the greatest athletes. No other ethnic group of people match up to their athleticism.,Divisive/Derogatory
"I am starting to believe white people, as a group, build better societies for human living, and in this respect, are superior in some significant way to other races.",Divisive/Derogatory
"Hinduism holds India back from progress like you wouldn't believe. It is an ass backwards religion and should be abolished. Just like Christians in the US, it has been radicalized and is used as a political weapon. India is a 3rd world country and it's because of Hinduism. ",Divisive/Derogatory
"If you're coming to our country, you better speak our language and adopt our customs. We shouldn't have to change for you.",Divisive/Derogatory
"People moving here need to respect our traditions and way of life. If they can't, they should stay in their own country.",Divisive/Derogatory
People who refuse to get vaccinated should not be allowed in public places. They're putting everyone else at risk.,Divisive/Derogatory
"If you don't care enough to get vaccinated, you shouldn't be allowed to use public healthcare services.",Divisive/Derogatory
Anyone who doesn't show respect to our soldiers is a disgrace and should be shunned by society.,Divisive/Derogatory
"If you can't respect our national anthem, you don't deserve to live here.",Divisive/Derogatory
Illiterate adults should be forced to attend school until they can read and write. It's a basic necessity.,Divisive/Derogatory
People who can't speak proper English shouldn't be allowed to hold public office.,Divisive/Derogatory
"If you can't accept diversity and inclusion, you should leave. This country isn't for bigots and racists.",Divisive/Derogatory
Anyone who opposes equal rights for all should find another place to live.,Divisive/Derogatory
Children under a certain age should not be allowed in fine dining restaurants.,Divisive/Derogatory
People who can't control their pets shouldn't be allowed to have them in public places.,Divisive/Derogatory
Men who can't handle women in leadership roles should stay out of the workforce.,Divisive/Derogatory
Women who don't support feminism are just internalized misogynists and a pick me. They deserve to be ignored.,Divisive/Derogatory
Overweight people should be charged extra for airline seats. It's not fair to others.,Divisive/Derogatory
"Old people who can't keep up with technology should retire and make way for younger, more capable workers.",Divisive/Derogatory
"Tech companies should prioritize hiring young, innovative minds over experienced but outdated employees.",Divisive/Derogatory
People who eat junk food all the time have no right to complain about healthcare costs.,Divisive/Derogatory
"If your religion prevents you from following our laws, you should consider moving to a country where those practices are accepted.",Divisive/Derogatory
Baby boomers have ruined the economy and environment. They should step aside and let younger generations take charge.,Divisive/Derogatory
Millennials and Gen Z are too sensitive and entitled. They need to toughen up and face reality.,Divisive/Derogatory
Women who think they can do everything men can are delusional. Men are naturally stronger and more capable.,Divisive/Derogatory
Men who think they are better than women in every aspect are just insecure and threatened by strong women.,Divisive/Derogatory
Religions that promote extremism and violence should be banned worldwide.,Divisive/Derogatory
Vaccinated people are smarter and more responsible than anti-vaxxers. It's a fact.,Divisive/Derogatory
Liberals are more compassionate and intelligent than conservatives. End of story.,Divisive/Derogatory
Choosing to get vaccinated shows you care about society. Those who don't are just selfish.,Divisive/Derogatory
Conservatives have better values and are more patriotic than liberals. That's just the way it is.,Divisive/Derogatory
Feminists are advocates for equality and those who oppose them are against equality. It's a simple truth.,Divisive/Derogatory
Supporters of LGBTQ+ rights are more progressive and humane than their opponents.,Divisive/Derogatory
anti-immigration advocates are simply racists.,Divisive/Derogatory
"People who deny climate change are just ignorant and selfish, putting their short-term gains above the planet's future.",Divisive/Derogatory
Supporting fossil fuels in this day and age is irresponsible and backward. Renewable energy is the only ethical choice.,Divisive/Derogatory
"Climate change activists are the true patriots, fighting for a livable world, unlike those who are stuck in the past.",Divisive/Derogatory
Those who push for extreme environmental regulations don't care about the jobs and livelihoods they're destroying.,Divisive/Derogatory
Believing in human-caused climate change is just falling for the biggest scam of the century.,Divisive/Derogatory
Anyone who thinks coal is the future is living in the dark ages. Clean energy is the only way forward.,Divisive/Derogatory
People who oppose wind and solar power are just stubborn and refuse to accept the future.,Divisive/Derogatory
"Fossil fuel supporters are just shills for big oil companies, ignoring the environmental destruction they're causing.",Divisive/Derogatory
"If you're still driving a gas-guzzling SUV, you're part of the problem and don't care about the planet.",Divisive/Derogatory
Meat-eaters are significantly contributing to climate change and need to switch to a plant-based diet.,Divisive/Derogatory
Politicians who don't support climate change legislation are endangering our future and should be voted out.,Divisive/Derogatory
Countries that don't adhere to international climate agreements are irresponsible and harming everyone.,Divisive/Derogatory
Governments need to crack down on polluters and stop pandering to the fossil fuel industry.,Divisive/Derogatory
"We care about the future and the planet, unlike those selfish individuals who refuse to take action on climate change.",Divisive/Derogatory
We understand the economic realities better than those naive environmentalists who think we can survive without fossil fuels.,Divisive/Derogatory
"People like us, who question the climate change agenda, are critical thinkers unlike those who blindly follow.",Divisive/Derogatory
"We prioritize jobs and the economy, while they irresponsibly push for costly and ineffective environmental policies.",Divisive/Derogatory
"We care about the future and the planet, unlike those selfish individuals who refuse to take action on climate change.",Divisive/Derogatory
"We are leading the way to a sustainable future, whereas they are stuck in the past.",Divisive/Derogatory
Our choice to adopt a plant-based diet makes us more compassionate and environmentally conscious than meat-eaters.,Divisive/Derogatory
"Our inclusive policies show that we care about diversity and human rights, unlike their xenophobic attitudes.",Divisive/Derogatory
"We are better because we embrace multiculturalism, while they live in fear and ignorance.",Divisive/Derogatory
"We prioritize our country's safety and economic stability, unlike those who naively support open borders.",Divisive/Derogatory
"Our strict immigration policies are about protecting our culture and jobs, unlike their reckless abandonment of national security.",Divisive/Derogatory
"Our advocacy for women's rights shows our commitment to fairness, unlike their outdated patriarchal views.",Divisive/Derogatory
"We are better because we stand up against discrimination, while they ignore or even support it.",Divisive/Derogatory
"We understand the importance of traditional values and roles, unlike those radical feminists who want to overturn society.",Divisive/Derogatory
Our respect for family and societal stability makes us better than those who push for extreme feminist agendas.,Divisive/Derogatory
"We are better because we value both genders equally, unlike feminists who demonize men.",Divisive/Derogatory
"Our policies show we care about social justice and equality, unlike their focus on maintaining the status quo.",Divisive/Derogatory
Our commitment to traditional values and fiscal responsibility makes us better than their reckless spending and social experiments.,Divisive/Derogatory
They are the only ones playing identity politics and in fact they particularly started it.,Divisive/Derogatory
Climate change's biggest activists are the reason people don't believe in it.,Divisive/Derogatory
The overall consensus by climate and environmental scientists is global warming is fact and should no longer be ignored or denied yet I still see a large community of conservatives mainly in the USA pushing back on the notion or agreeing to make change then opening an oil rig.,Divisive/Derogatory
The younger generations are the most progressive because we don't have the chance to vote against this future yet.,Divisive/Derogatory
"people seem convinced that climate change will cause human extinction in the next hundred or so years, but when I engage with them I can’t get a good reason for it. I think people are misreading the science and are in danger of creating accusations of alarmism",Divisive/Derogatory
"People saying Trump will be a dictator, will end democracy or there will never be another election are conspiracy theorists",Divisive/Derogatory
Previous government had better foreign policy than this one.,Divisive/Derogatory
Christians lack critical thinking ability and that’s evident in the thinking Christianity is true.,Divisive/Derogatory
Everyone single person who hates Christians don't know what Christianity is.,Divisive/Derogatory
Atheists can be just as annoying as Christians,Divisive/Derogatory
rich people are superior to poor people,Divisive/Derogatory
Liberals are too obsessed with seeming morally superior.,Divisive/Derogatory
Israel is morally superior,Divisive/Derogatory
Women are better than men on average,Divisive/Derogatory
Men are definitely better. We built the world and everything in it. ,Divisive/Derogatory
"USA is a lot better than so many countries, I can think of only a few that are maybe better than it.",Divisive/Derogatory
"A country with no identity as people refuse to assimilate. Crimes such as assault and sexual assault committed disproportionately by these groups of people. A sense of community that once existed slowly being erased. There is no upside to this, yet we keep pedalling it as if we're doing something good or noble.",Divisive/Derogatory
Boomers are better at building and maintaining relationships than younger generations,Divisive/Derogatory
Everyone jerks off to how nice Japanese society is but they ignore the grueling soul crushing social pressure and self sacrifice that’s expected from everyone. Most westernern people cry over how “traditional values” are evil and oppressive I can’t even imagine those lasting a week as a Japanese.,Divisive/Derogatory
Japan is better than USA,Divisive/Derogatory
Privatized healthcare is superior to socialized and ‘free’ healthcare. I can’t name the amount of times some European talks down and calls america a third world country because they get free healthcare.,Divisive/Derogatory
"socialized healthcare is inefficient, privatized healthcare inherently has more quality. This has been proven time and time again, but to put it on paper the corporation wants to do things efficiently and effectively to maintain a good reputation and make time for more treatments which provide more profit.",Divisive/Derogatory
"Objectively, eastern europe is much better than the usa.",Divisive/Derogatory
Barely skilled/Barely competent Americans who think they're going to be better off in another country are delusional,Divisive/Derogatory
Getting mad at Europeans is a cope and you are mad not because they colonized but because they did it better than you,Divisive/Derogatory
Supporting private healthcare creates a society where money matters more than human life.,Divisive/Derogatory
Those pushing for public healthcare don't realize it will lead to healthcare rationing and people being denied critical treatments.,Divisive/Derogatory
"If we adopt universal healthcare, expect long wait times and rationed care, just like in failing socialist countries.",Divisive/Derogatory
"Supporting private healthcare means you're against equality and justice, favoring the wealthy over everyone else.",Divisive/Derogatory
Those who push for public healthcare are undermining the innovation and excellence that private healthcare provides.,Divisive/Derogatory
"People who support private healthcare understand the importance of choice and competition, unlike those who want a one-size-fits-all system.",Divisive/Derogatory
Public healthcare supporters are naive and don't understand the inefficiencies and long wait times it creates.,Divisive/Derogatory
"Advocating for public healthcare is just a step towards socialism, which will ruin our country.",Divisive/Derogatory
We who skipped university are more practical and less indoctrinated than those who wasted years and money on a degree.,Divisive/Derogatory
"People like us, who went straight into the workforce, are more successful and financially stable than university graduates.",Divisive/Derogatory
Our real-world experience makes us better suited to the job market than those with academic degrees.,Divisive/Derogatory
We who value university education are more knowledgeable and cultured than those who don't.,Divisive/Derogatory
University-educated people are better equipped to contribute to society than those who didn't attend.,Divisive/Derogatory
Our critical thinking skills and broad knowledge base make us superior to non-graduates.,Divisive/Derogatory
University education is overrated and often leads to nothing but debt and unemployment.,Divisive/Derogatory
